Field 1,Parent company,Vendor,Business status,link,Country of origin,Software type,Focus,Twitter,Crunchbase,Website shutdown date,B2B vs B2C,Financials,Last edit
,,"SalesWedge saleswedge.com @SalesWedge like eHarmony for sales. Account executives can instantaneously find their counterparts in an alliance to get insight and referrals into accounts. Executives can measure partner engagement & impact. “Alliance enablement tool” Toronto, Ontario, Canada",Out of Business,https://twitter.com/SalesWedge,Canada,,,https://twitter.com/SalesWedge,,,,,20 January 2023
,,"Salient6 salient6.com in Bellevue, WA. Designers/builders of portals/applications that drive business results & a prototype Sales Enablement tool to “increase the productivity of your sales force”. Salient6 is a consulting company creating end-to-end solutions that realize the full business value of the SharePoint platform.",Out of Business,,USA,,,,,,,,20 January 2023
,,"Salire salire.com @saliresales sales enablement company reclaiming the wasted time in a sales person's day. Products designed to help Sales Leaders be more effective at managing both their teams & the client. Seattle, WA",Out of Business,,USA,,,,,4/9/2020,,,22 January 2023
,,"SAM (Sales Accelerator Matrix) SAM.Coach @samcoachai powered by AI. Intuitive platform with human-like intelligence calibrated for improving sales forecast accuracy & generating more sales. Helps salespeople increase ROI on their selling time. Enables BDMs, AMs, Pre-sales consultants effectively capture & validate critical customer information, which ultimately underpins the accuracy of sales forecast. By leveraging a common & objective platform, SAM also helps sales managers reduce time & increase effectiveness when providing accounts review, win/loss analysis & coaching. The startup has three objectives, 1. increase ROI on salespeople’s selling time (& sales managers’ time on accounts review, win/loss analysis & coaching); 2. improve sales forecast accuracy, & 3. eliminate the need to manually enter information into CRMs. Sydney, Australia",Active,http://sam.coach/,Australia,,,https://twitter.com/samcoachai,,,B2B,,26 September 2022
141,SAP,"SAP litmos.com SAP Litmos Learning Management System (LMS) powers training for today’s intelligent enterprise. LMS, Commerce platform, & content-rich course catalog that make it easy to manage the entire learning program from system implementation & integration to ongoing administration. Empowers organizations to align corporate training with the company’s most important strategic goals. Offers a SaaS-based learning management system that enables trainers to merge media-rich content with seamless online delivery. Dublin, California, USA","Acquired,Active",https://www.litmos.com,USA,,,https://twitter.com/litmos,https://www.crunchbase.com/organization/litmos,,,,20 January 2023
141,SAP,"SAP, the German enterprise software giant, announced it acquired CallidusCloud for $2.4 billion on Jan 29, 2018. (Callidus Software Inc. had purchased iCentera) SAP had also made an investment in SAVO but SAVO was acquired by Seismic May 8, 2018. Sales Enablement revenue is not published for SAP, but they have established SaaS solutions for CRM, Sales Forecasting, CPQ, Enablement, CLM, Marketing Automation, Commissions, LMS.","Rebranding,publicly-traded company",https://www.sap.com,"Germany,USA",,,,,,,,20 January 2023
142,"Seismic,Permira permira.com Global investment firm","SAVO Group savogroup.com (Investment from SAP) KnowledgeTree was acquired by SAVO Group; announced Jun 12, 2017. Then on May 8, 2018, it was announced that Seismic acquires SAVO Group (See Seismic)",Acquired,https://seismic.com,USA,,,,,,,,7 March 2022
143,SCAURA BV,"Scaura scaura.com founded 2015 in Amsterdam. Mission: Help companies to drive their B2B sales results via an easy to use & intuitive software platform which brings digital content via a branded application to the fingertips of sales teams & enables them to support any client interaction with relevant content, in the most efficient way. “Sales Presentations made easy! Easy to use & low-cost Sales Presentation solution to drive your B2B Sales. Helps improving Customer Buying Experiences. The platform analyzes what resonates with prospects & clients in an engaging branded environment. Engage prospects with the right sales content. Anytime & anywhere. Digital marketing, knowledge sharing & effective sales enablement are increasingly important in today’s B-2-B world. Makes it easy for your sales team to find, present & share the latest sales content – even when they’re offline. Your team is ready whenever the time calls for it. We give you a dedicated channel so, you can align your sales teams with a dynamic stream of sales content. Your sales team will have an effective Sales Presentation tool which will make their work easier & more effective.” Amsterdam, Netherlands / Dutch",Active,https://scaura.com,Netherlands,,,,,,,,11 May 2023
,,Scepos scepos.com Netherlands based / Dutch,Out of Business,,Netherlands,,,,,,,,20 January 2023
,SCIOLYTIX INC.,"Sciolytix sciolytix.com @sciolytix software company revolutionizing the way organizations onboard & develop people, & align training with performance. Through experiential learning & predictive analytics, we are changing the way organizations onboard & develop people, & align training with performance. UPtick Sales Simulation Training Ecosystem: Unlock the power of immersive 3D simulations for all organizations to train & develop their sales teams. UPtick: The Practice Simulator for Salespeople: 3D immersive simulations & analytics to onboard & develop salespeople more effectively. Enables reps to practice the real-life customer interactions they face. Like playing a video game, reps work their way through challenging scenarios & receive consistent, expert feedback from UPtick’s virtual coach. Simulators are effective tools for developing mission-critical skills: Challenging, engaging video game-like experience applied to sales training. Creates an emotional connection to training content that drives repetition. Extensive simulation library, fully customizable to your selling situation. Founded 1998. New York, NY, USA SCIOLYTIX INC. DigitalChalk digitalchalk.uk is a product of Sciolytix: Learning Management System. No matter who you train, from our platform to our people, DigitalChalk provides the functionality & expertise you need for your eLearning program.",Active,https://digitalchalk.uk,USA,"3D,VR",learning management system,https://twitter.com/sciolytix,https://www.crunchbase.com/organization/sciolytix,,B2B,,25 April 2023
96,"""Observe.AI d/b/a Z21 Labs, Inc.""","ScopeAI getscopeai.com @ScopeAI automatically extracts actionable insights from customer service conversations using NLP (Neuro-linguistic programming). San Francisco, CA, USA. Also known as Quiki. 31-Aug-2021, Observe.AI acquires ScopeAI (to advance omni-channel ambitions) for an undisclosed amount. San Francisco, California, US. Z21 Labs, Inc. Observe.AI’s new Generative AI Suite empowers agents throughout the entire customer interaction process, improving performance & productivity every step of the way. Knowledge AI: Answer customer questions faster & better than before","Acquired,Rebranding",https://www.observe.ai,USA,"ML,SaaS",,https://twitter.com/scopeai,https://www.crunchbase.com/organization/quiki,3/7/2021,B2B,https://www.crunchbase.com/organization/quiki,10 October 2023
,Scopify Intel Inc. d/b/a Scopify,"Scopify AI scopify.ai @Scopify_ai Google your next customer! No more email, phone number, job titles, firmographic data based spray & pray. Scopify’s AI gives you Budget, Authority, Need, Timeline (BANT Intel) on leads & prepares outreach scripts which get you more qualified meetings. Platform that gives you the intelligence that pre-qualifies your leads for you. Decision Maker engagement with on demand personalized sales outreach scripts. Toronto, Ontario, Canada. Scopify Intel Inc. d/b/a Scopify",Active,https://scopify.ai/,Canada,,,https://twitter.com/Scopify_ai,,,B2B,,19 March 2022
,"""Scratchpad, Inc.""","Scratchpad scratchpad.com @scratchpad_ai Update Salesforce faster with Scratchpad. Designed specifically for AEs to reduce clicks, tab switching, & admin work. THE REVENUE TEAM WORKSPACE: Improve your sales performance. Workspace built for sales - with account executives in mind, which means speed. Combines sales notes, spreadsheets, tasks, Kanban boards, search, collaboration, & sales process adherence in one simple & intuitive workspace - connected to Salesforce to eliminate all those tabs & double work. End scattered sales data: Eliminate the spread of high value sales data across sheets, docs, & apps. Scratchpad consolidates valuable sales data in a workspace that syncs instantly with Salesforce. No more reps copying & pasting from random apps & no more missing sales data. Scratchpad, Inc. California, USA",Active,https://scratchpad.com,USA,,,https://twitter.com/scratchpad_ai,,,,https://martechseries.com/sales-marketing/crm/scratchpad-secures-13-million-series-funding-bring-comprehensive-workspace-revenue-teams/,11 May 2023
,SCREENAPP PTY LTD,"ScreenApp screenapp.ai https://twitter.com/screenappio unlock the power of corporate video content. Unify your videos in one comprehensive knowledge workspace. Get answers from your videos. Fast & efficient way to capture your screen & extract insights. Record your screen, transcribe it & transform your content into valuable knowledge. Say goodbye to note-taking. Need to record, store & extract knowledge from high-value videos? By using AI to extract insights & present them in a user-friendly format, ScreenApp can help users access the information they need without having to manually watch through all of their videos. Import all your videos into the platform & ask questions in natural language, just like talking to a person who had watched all of the videos. The AI-powered system provides relevant answers to the user’s queries, making it easy to find the information they need. Sydney, New South Wales, Australia. SCREENAPP PTY LTD",Active,https://screenapp.io,Australia,"SaaS,video","CMS,knowledge management,searching finding discovery,video",https://twitter.com/screenappio,,,B2B,,1 October 2023
,ScreenCloud Limited / ScreenCloud Inc.,"ScreenCloud screencloud.com @screencloud we make it easier to put meaningful content on any screen, in any location. Your screens can do more. Unlock their potential! Software platform to drive engagement, productivity & sales with digital signage. Workplace Employee Screens: The content management system Comms Pros need to drive employee engagement & productivity. Commercial Customer Screens: Screens for modern comms that drive sales & engage happy, repeat customers. Unlocking your screen potential is more important now than ever, when hundreds of communication channels are competing for your audiences’ attention. Screens surface relevant, repeated, & real-time information. Secure & simple content management: Aggregate existing content, or create your own. Plus, you’ll have peace of mind from enterprise-grade security, audit logging & user controls like SSO & custom permissions. ScreenCloud Limited / ScreenCloud Inc. London, UK. New York, USA",Active,https://screencloud.com,"USA,UK",SaaS,,https://twitter.com/screencloud,,,,,16 March 2022
,Rock Content,"ScribbleLive scribblelive.com Empower your sales team with the content they need to support stronger sales conversations. By adding sales enablement solutions into your content marketing mix, sales teams can amplify lead generation and lead quality efforts, providing better insights to marketing.  Armed with relevant, useful content, your sales team is empowered, which allows them to have better sales conversations that lead to more revenue & quicker sales cycles. Trapit was acquired by ScribbleLive in May 2017. The ScribbleLive Plan product allows marketers to document content strategies, publish content to collaborative channels,..."" Toronto, Ontario, Canada (Rock Content has acquired ScribbleLive on Dec 10, 2019. Rock Content: SaaS, Marketplace. Belo Horizonte, Minas Gerais, Brazil)",Acquired,https://en.rockcontent.com/,Canada,,,https://twitter.com/scribblelive,https://www.crunchbase.com/organization/scribblelive,,,https://www.crunchbase.com/organization/rock-content,29 July 2022
,Scribd Inc.,"scribd scribd.com @Scribd Scribd Inc. Scribd will begin operating the SlideShare slideshare.net @SlideShare business on September 24, 2020. SlideShare used to be owned by LinkedIn which is owned by Microsoft. LinkedIn acquired SlideShare in May 2012","Acquired,Active",https://www.slideshare.net/Slideshare/slideshare-is-joining-scribd-237760779/,USA,,,https://twitter.com/SlideShare,,,,https://www.slideshare.net/Slideshare/slideshare-is-joining-scribd-237760779/,22 January 2023
144,ACTO Technologies Inc.,"Scrimmage wescrimmage.com @wescrimmage mobile learning platforms & sales enablement software to help reinforce training, improve speed to competency, & enhance sales productivity. Minneapolis, MN, USA. Minneapolis-based mobile learning company Scrimmage has been acquired by Canadian software company ACTO, the companies announced 11-SEP-2020. http://pulse.actoapp.com/actoscrimmage/","Active,Acquired",https://www.wescrimmage.com/,USA,,learning management system,https://twitter.com/wescrimmage,https://www.crunchbase.com/organization/scrimmage,,,,7 May 2023
,Algolia,"Search.io Search.io @SearchioHQ (Formerly Sajari sajari.com) Enables every organization to create smart search experiences. Delight your customers with a faster, simpler site search experience: We built our own proprietary AI search engine to deliver incredible results at scale so you can provide your customers with a fast, accurate, & smart on-site search & discovery experience. Search.io Pty. Ltd. San Francisco, CA, USA & Sydney, NSW, Australia. 13-Sep-2022: Search.io, a Sydney artificial intelligence-based search start-up, has been acquired by French unicorn company Algolia for more than $100M AUD?, generating a healthy return for early investor Tidal Ventures","Active,Acquired",https://www.search.io,Australia,"SaaS,ML",searching finding discovery,https://twitter.com/searchiohq,https://www.crunchbase.com/organization/search-io,,B2B,http://mna.im/acquisition/?viewmodes=1&acquisitionID=87337&title=Algolia__acquired_Searchio_Pty_Ltd,4 October 2022
,SecondNature AI INC,"Second Nature secondnature.ai https://twitter.com/SecondNatureAI COACH, TRAIN & CERTIFY YOUR SALES TEAMS FASTER & BETTER: The platform your sales team needs to adapt quickly & keep winning. Scale up your sales coaching with Second Nature’s sales coaching software. It provides a “virtual pitch partner” that uses conversational AI to have actual discussions with sales reps, score them, & help them improve on their own, so they can ace every sales call. Create consistency, standardization & track improvement. Rollout new offerings & messages faster. Increase revenue per rep. SecondNature AI INC, Tel Aviv-Yaffo, Israel",Active,https://secondnature.ai,Israel,,,https://twitter.com/SecondNatureAI,,,,,21 April 2023
,Twilio,Segment segment.com is owned by Twilio just like Sendgrid sendgrid.com,"Active,Acquired",segment.com,USA,,,,,,,,11 May 2023
145,Seidat ltd.,"Seidat seidat.com @SeidatApp cloud-based slide deck platform that enables creating interactive slide decks for any occasion & easily sharing them with your team & customers. Gives you the opportunity to manage all your slide decks under one platform. Keeping your material up-to-date & according to your brand for all your team members has never been this easy. Presentation platform for teams. Create, edit, present & share interactive presentations within the same app. Sell more efficiently with navigable pitch decks, save time with updates by using Smart slide, keep your brand consistent in all slide decks with brand & team management. KEEP YOUR TEAM’S PITCH DECKS UP TO DATE: Any changes made within a team are visible to all. You no longer have to worry about everyone having the most recent presentation materials. Seidat’s cloud does that for you. Team collaboration is easy when everyone always gets the latest materials automatically. ""Presentation platform for teams. Create, edit, present and share interactive presentations within the same app."" $99.4K in estimated revenue annually. Helsinki, Finland",Active,https://www.seidat.com,Finland,,,https://twitter.com/SeidatApp,https://www.crunchbase.com/organization/seidat,,,,18 April 2023
142,"Seismic,Permira permira.com Global investment firm","Seismic seismic.com @seismicsoftware app that accesses a cloud-based library of your company’s brand collateral & business materials — all backed by a live data feed — to generate meaningful, integrated content on demand. The single place where all your brand-approved materials are up to date & accessible from anywhere. Can sit inside the salesforce.com CRM or others. Based in CA, US. Partnership with Genuine Interactive. Nu:Pitch became Seismic. (On 8-May-2018, it was announced that Seismic acquired SAVO Group, which had acquired KnowledgeTree 12-Jun-2017. Percolate percolate.com @percolate Percolate Industries, Inc. acquired by Seismic 5-Nov-2019.) 1-Dec-2020, Seismic acquired Grapevine6 (a social & digital sales engagement platform / a way to engage with buyers on social media). As a result of the acquisition, Seismic launched a new integrated offering called Seismic LiveSocial, a social engagement solution for sales & client-facing teams. It leverages the AI engine built by Grapevine6 to help sellers become advisors by authentically engaging with their prospects & clients across the social media landscape. Sales teams can share timely & compliant content from 11k+ third-party publishers across 6 different languages, targeting the right buyers across multiple social platforms. Additionally, brand leaders can measure the ROI of their social engagement strategy. 19-Aug-2021, sales enablement & marketing orchestration platform Seismic acquired Lessonly, a provider of sales training, coaching, & enablement solutions. With this acquisition, the company will provide sellers the access to marketing & sales content as well as coaching plans, learning programs, & practice scenarios in one location. In addition to the acquisition, the company has also closed a $170M Series G funding bringing the company’s valuation to $3B. Obie acquired by Lessonly 29-Jul-2021. Lessonly is part of Seismic.",Active,https://seismic.com,USA,SaaS,,https://twitter.com/SeismicSoftware,https://www.crunchbase.com/organization/seismic-software,,B2B,https://www.owler.com/company/seismic,14 May 2022
,Sellizer sp. z o.o. (ltd.),"Sellizer sellizer.io Sellizer.pl @sellizer comprehensive sales supporting tool that will help you build better customer relationships. Understand your customers better. Close more deals. Each of us needs effective sales process. Sales reps gain access to the tool that effectively supports the sales process. Customers are reassured that the company will contact them while they are reading they proposal. With this solution sales reps can focus on hot leads & customers will get answers to their questions. Motivates sales reps. Sellizer sp. z o.o. (ltd.), Rzeszów, Poland",Active,https://www.sellizer.io,Poland,,,https://twitter.com/sellizer,,,,,16 February 2022
,,"SellsPad SA sellspad.it @SellsPad (former TappCtrl tappctrl.com) sales tool composed of two main elements: Online Web Manager controlled by your Sales Manager or Commercial Director & iPad App installed on all devices distributed & configured for your sales team. Now branded as SellsPad sellspad.com Take orders on the go right from your tablet. Always up to date, fast & secure. Improve your sale cycle efficiency. Have the right information at the right time: Documents, presentations, client info, catalog, etc. even when you are offline. Simplify reporting for the people in the field & get detailed information about what really happens in the field. Brussels, Belgium",Out of Business,http://sellspad.it/,Belgium,,,https://twitter.com/SellsPad,https://www.crunchbase.com/organization/sellspad,14/3/2022,,,14 March 2022
,,"Sendbloom sendbloom.com @sendbloom beautiful, seamless prospecting automation software that helps teams structure, automate & optimize their inside sales processes. The sales organizations at LinkedIn, BMC, Pure Storage, & hundreds of other enterprises rely on Sendbloom daily to increase sales velocity & empower their global initiatives. San Francisco. Feb. 22, 2017, ClearSlide, Sales Engagement Platform, & Sendbloom, Prospecting Automation Software, announced a partnership & integration to increase sales velocity & improve business results. December 12, 2017, ClearSlide joined Corel Corporation. ClearSlide clearslide.com had acquired SlideRocket to let you create & edit presentations in the cloud with slide-by-slide analytics.",Out of Business,,USA,,,,,,,,20 January 2023
,,"Sendside sendside.net Customer Communication Platform & Secure Communication Network. “Goes beyond simple security and takes electronic communication to a new level enabling high-impact, interactive, one-to-one communications between an organization and its clients, customers and/or prospects via the web.” Sendside Deliver: Secure, cloud-based message & document delivery service. Unlike email & other paper-based methods, it helps simplify gathering important documents relating to a transaction and send them to interested parties.",Out of Business,,,,,,,,,,20 January 2023
,,"SenseDoc sensedoc.com gives you content recommendations as you write docs or create slides. The product analyzes your work as you write, then shows content from your hard drive, shared folders & the Internet to pull right into the doc. No more searching through files, googling images or asking for the latest slide on Yammer. We use machine learning techniques, cloud storage & the enterprise social graph to figure out what to recommend & when. Our team has spent 12 months coding a system that can analyze 200,000 document sub-parts & return highly relevant content recommendations within 0.2s. We work natively with PowerPoint & Word - just a simple plugin - within many different authoring apps & on the web. San Francisco, California, US",Out of Business,,USA,,,,https://www.crunchbase.com/organization/sensedoc,,B2B,,21 April 2023
,ServiceNow,"ServiceNow (NYSE: NOW) acquired Attivio IP, core technology, & select R&D talent; announced October 2019. With the addition of the⁦ @attivio ⁩search engine ⁦@servicenow moved beyond keyword-based search to deliver conversational AI & search experiences at scale to customers. servicenow.com cloud-based platform & solutions deliver digital workflows that help people do their best work. Santa Clara, CA, USA. ServiceNow, Inc. acquired Attivio, Loom Systems, Passage AI, Sweagle, Montrêal Canada based Element AI elementai.com @element_ai (on 1-Dec-2020).","Active,publicly-traded company",https://www.servicenow.com,USA,,,https://twitter.com/servicenow,https://www.crunchbase.com/organization/service-now-com,,B2B,NYSE: NOW,18 April 2023
,"""SetSail Technologies, Inc.""","SetSail setsail.co @SetSailCo Get complete & actionable sales signals from across all your systems — automatically & in real-time. AI-powered platform that combines data & behavioral science to drive more revenue per sales rep. Uses AI to identify the buying signals needed to close a deal. The platform then converts these signals into recommendations for sales reps, providing micro-rewards for following the best path of action & building good selling habits. SetSail Technologies, Inc. San Mateo, California, United States",Active,https://www.setsail.co,USA,"SaaS,ML","sales process,sales intelligence,Sales Enablement",https://twitter.com/setsailco,https://www.crunchbase.com/organization/setsail,,B2B,,8 June 2022
146,Setvi Inc,"SETVI setvi.com mobile sales enablement platform. Enables marketing & sales leaders to distribute, manage, update, & control marketing & sales materials instantly, from one central, cloud-based system. Make new or updated content available for instant access by your sales force. BUILD DYNAMIC PRESENTATIONS: Create unique presentations on-the-go & on-the-fly by combining PowerPoint decks, Keynote decks, PDF documents, video, images, live websites, YouTube videos, Vimeo videos, dynamic spreadsheets, 3D graphics, HTML5, & more. Understand which materials are being used by sales representatives & which materials are not. Analyze how customers & prospects engage with your materials. Philadelphia, PA, USA",Active,http://setvi.com,USA,,,https://twitter.com/setviapp,https://www.crunchbase.com/organization/setvi,,,,21 April 2023
