Field 1,Parent company,Vendor,Business status,link,Country of origin,Software type,Focus,Twitter,Crunchbase,Website shutdown date,B2B vs B2C,Financials,Last edit
,,This list is maintained by @SalesEnablement author of https://salesenablement.wordpress.com/ Request an update by filling: https://app.questmate.com/p/b054707b-869d-4969-887f-3e81134c56b7,,https://app.questmate.com/p/b054707b-869d-4969-887f-3e81134c56b7,,,,,,,,,
,,"1sales.io 1sales.io @1sales_io CRM Software for sales orgs - ready in under 60 seconds. #rethink1ngsales Bielefeld, NRW, Germany. Company shut down as of April 2023. Was a SaaS-based sales management tool for SMEs, helping sales teams to increase revenue & minimize administrative expenses.",Out of Business,www.1sales.io,Germany,,CRM,https://twitter.com/1sales_io,https://www.crunchbase.com/organization/1sales,20/4/2023,B2B,,20 April 2023
,,"1up 1up.ai @1up__AI Answer your sales team’s questions 10x faster with 1up: A knowledge automation platform for sales teams. Employs an enterprise-level question-answering system for generating up-to-date data-driven responses for anything that may arise during the sales process using a variety of secure LLMs. Sales professionals can access the information they need without having to fumble around for the right case study or response to a customer objection. Allows organizations to free up time for sales reps, on-board & train new sales professionals more efficiently, & utilize the most effective techniques at the right time with confidence. Address complex sales questions, respond to objections as well as complete RFPs with automation: Businesses use 1up to answer complex sales questions, respond to customer objections, & quickly complete RFP questionnaires. 1up automates knowledge for Sales teams: An enterprise-grade question-answering system built with data privacy & accuracy in mind. It combines a company’s external & internal knowledge sources & leverages multiple Large Language Models (LLMs) to generate accurate, up-to-date answers in seconds. New York City, NY, USA",Active,https://1up.ai,USA,"SaaS,ML",knowledge management,https://twitter.com/1up__AI,https://www.crunchbase.com/organization/1up-b96e,,B2B,,10 November 2023
,2VizCon GmbH,"2VizCon (new name 2Viz) old website 2vizcon.com new website 2viz.io Transforming Business Productivity Through AI-driven Enterprise Applications. Software for the development of platform independent enterprise applications in marketing, sales, communication, learning. Sales Enablement: Transform your sales strategy with impactful sales enablement applications to sell more. Marketing Enablement: Stage your brands, marketing messaging & content on an engaging mobile platform. Combine fragmented technology stacks to create one integrated technology, one connected platform, one productive team. Frankfurt, Germany & Kingston, Greater London, UK; Jakarta, Indonesia","Rebranding,Active",https://2viz.io,"UK,Germany,Indonesia",,,,https://www.crunchbase.com/organization/2vizcon,,B2B,,16 January 2023
1,7taps Inc.,"7taps 7taps.co @7tapsHq corporate learning tool for generation Slack. The growing workforce of Generation Z is extremely digitally savvy; yet prone to distraction & has a shorter attention span. Other digital Learning Management Systems (LMS) with a mountain of features – that overwhelm you & your staff – don’t produce the desired results. Engage Gen Z in a format they are accustomed to. A simple & short approach that can be grasped quickly & effectively. 7taps Inc., New Castle County, Delaware, USA",Active,https://www.7taps.co,USA,,,https://twitter.com/7tapsHq,,,B2B,,12 January 2022
,20 Miles Inc.,"20 MILES Inc. 20miles.us @20MilesSoftware (Former fileboard.com). 20 Miles sales platform enables consistent outbound prospecting at scale, leading to more meetings & opportunities. Create workflows that automatically reach prospects across multiple channels. Get more meetings & opportunities while spending less time prospecting. San Francisco, California, USA, Website offline as of 4-Apr-2022","Pivoted,Rebranding,Zombie?,Out of Business",http://20miles.us,USA,SaaS,CRM,https://twitter.com/20MilesSoftware,,4/4/2022,B2B,,4 April 2022
,"60 Seconds Pty Ltd,60seconds ltd","60 Seconds 60seconds.com https://60seconds.com/about/ https://www.60secondsapp.com/ 60 seconds app London, UK 60seconds ltd @60Seconds_app Use gamification to drive immediate customer purchases. For Australia the focus seems: Mobile coaching app that helps improve the quality & cut-through of sales professionals’ conversations. Scripting, Rehearsing, Delivering, Sharing. For Sales Manager: Observing, Coaching, Measuring, Strategising. Sydney, NSW, Australia. 60 Seconds Pty Ltd. London, UK, 60seconds ltd",Active,https://60seconds.com/about/,"Australia,Serbia,UK",,mobile,https://twitter.com/60seconds_app,https://www.crunchbase.com/organization/60seconds-b4ec,,"B2B,B2C",,16 January 2023
,360insights (Canada) Ltd.,"360insights 360insights.com @360insights Channel Success Platform empowers brands to create, measure, & manage their channel incentives programs. 360insights (Canada) Ltd., Canada",Active,https://360insights.com,Canada,SaaS,Channel (Partner) Enablement,https://twitter.com/360insights,,,B2B,,10 January 2022
2,"""Accent Technologies, Inc.""","Accent Technologies accent-technologies.com @accent_tech Accent Accelerator for Sales & Marketing Teams: Designed to empower sales teams with information, insight & technology. Deliver the right information at the right time, have more meaningful conversations, build credibility with buying teams & win more deals through precise, efficient execution. Content, coaching & insight at their fingertips. Provides tools to deliver & track information in a unique personalized way. Now integrating with OpenAI’s ChatGPT AI Engine! AI AT YOUR FINGERTIPS: CHATGPT CUSTOMIZED For Your Team. Put the latest AI technology to work with your own ChatGPT knowledgebase that answers detailed questions about your products, services, accounts, opportunities, pipeline—even with detailed recommendations for next steps & improvement. Customized to know your business: All the knowledge & power of ChatGPT plus the knowledge of your business. It knows your company, products, services, competitors, industry… & anything else you need it to know. Ask a question about your business, you get the answer. It’s that simple. No implementation needed, minimal if any training for the team, no big rollout. Just an incredibly smart assistant that can help with about anything. Want to Know About Sales? Your Sales Assistant will tell you anything you want to know about your deals. Just ask & get the answer. The Sales Assistant is loaded with all the information from our Synthesis Analytics Engine—purpose-built Sales Engine! Helps You Write Emails and Create Personalized Content Your Chat Assistant is not as smarter as ChatGPT—it’s smarter! It knows you & your buyers; & can help you write on-target emails & create personalized content that directly fit your buyer’s needs. FL, USA. Accent Technologies, Inc.",Active,www.accent-technologies.com,USA,"ML,SaaS",Sales Enablement,https://twitter.com/accent_tech,https://www.crunchbase.com/organization/accent-technologies,,B2B,https://www.owler.com/company/accent-technologies,14 April 2023
,Tata Group,"AccessBell accessbell.com @access_bell Customized Video Conferencing for Enterprise Workflows. Customized, self-serve, fully-managed video conferencing for your workflows & apps. Founded March 2020. Expand your Zoom experience with features including real-time collaboration, personal notes, & agendas that sync with tools you already know & love. Take personal & collaborative notes & assign action items during the meeting. Organize your meetings with an agenda to indicate the progress of the meeting. Integrate seamlessly with Slack, Drive, Email, & other productivity tools. Track user engagement & better understand your meeting participation. Palo Alto, CA, USA. PALO ALTO, Calif., June 7, 2021 /PRNewswire/ -- AccessBell, a VC-backed silicon valley startup founded by Stanford MBAs, sold its video conferencing software solution to Tata Medical & Diagnostics for an undisclosed amount. What started as a trial converged into a solution which is being used to provide teleconferencing services to deliver healthcare services.",Acquired,https://www.tata.com,USA,,,https://twitter.com/access_bell,https://www.crunchbase.com/organization/accessbell,,B2B,https://www.prnewswire.com/news-releases/tata-group-buys-accessbells-video-business-301306537.html,11 August 2022
136,"ACQUIA INC,Vista Equity Partners","Acquia acquia.com @acquia cloud platform for building, delivering & optimizing digital experiences. With the Acquia Platform, organisations can realize personalised, contextual & real-time customer engagement for the right person, at the right time, on the right device. These experiences can be deployed & managed at scale, for 1 to 1000s of sites. Acquia Lift “Content Hub”: Aggregate, syndicate & discover content across a disparate network of sites & channels, no matter the content source. Empower your business team to find content, so that your IT resources have more time to focus on higher priority issues. Break down content silos with powerful discovery tools to quickly find relevant content from other sites, departments, or technologies. Separate the content source from the site architecture or the code that powers the experience, giving you agility to design a great digital experience for your customers. Boston, DC, Portland, & Reading, UK. 8-Sep-2021, Acquia acquired Widen Enterprises, Inc. widen.com @widen for an undisclosed amount. Acquia was acquired by Vista Equity Partners.","Active,Acquired",www.acquia.com,"UK,USA",,,https://twitter.com/acquia,https://www.crunchbase.com/organization/acquia,,B2B,https://www.crunchbase.com/organization/acquia,17 March 2022
,Acquire Inc,"Acquire acquire.io @acquire_io Grow revenue, boost sales & improve support with our comprehensive customer support tools. Knowledge base software that saves you time: Create, organize, & share your customer-facing help center resources using Acquire Knowledge Base. Ready to level up your knowledge base? Scale support & always have the right answers with Acquire Knowledge Base. Got knowledge lying all over the place? No worries. Easily import all your content into Acquire. Knowledge Base Toolkit. Knowledge is power: Acquire’s Knowledge Base software helps you streamline customer service & grow your help resources through powerful features. Knowledge Base & Chatbot: A power couple. Address repetitive questions with a chatbot that suggests relevant knowledge base articles to customers without needing a live support agent. San Francisco, CA",Active,https://acquire.io,USA,,,https://twitter.com/acquire_io,https://www.crunchbase.com/organization/acquire-68dc,,,,28 April 2023
,"""ActiveCampaign, LLC""","ActiveCampaign activecampaign.com @ActiveCampaign customer experience automation platform helping businesses grow through meaningful engagement with their customers. Notify your team when leads take action: Tell your salespeople when their leads take action. If a lead browses specific pages or puts in a pricing request, send an automatic notification so that your salesperson can follow up directly. ActiveCampaign enables Sales teams in volume: 125 email templates available on the customer experience platform. Each template has been designed using HML & includes images & layout suitable for a wide range of B2B & B2C engagements. The templates also include the codes to draw in data from the Active Campaign platform to enable the easy creation of targeted email campaigns. Email marketing is still the king of B2B marketing! The responsive templates slot into one of 500+ automation recipes that ActiveCampaign has on its platform. These enable the automation of the complete sales lifecycle for a customer. Templates are usable for any product & any brand within a portfolio. It is possible to switch colours, fonts, & images & update text. The responsive design ensures that every email sent is easily read, no matter what the device used. More than half of all emails are opened on a mobile device! ActiveCampaign, LLC. Chicago, IL, USA. 3-May-2022, ActiveCampaign acquired Postmark as it builds on rapid growth: Postmark and DMARC Digests, two products owned by Philly web dev mainstay Wildbit, were sold to Chicago-based ActiveCampaign. USA",Active,https://www.activecampaign.com,USA,,,https://twitter.com/ActiveCampaign,,,"B2B,B2C",,31 May 2022
144,ACTO Technologies Inc.,"ACTO acto.com @ACTOapp Omni-channel Education & Engagement platform for life sciences: Disrupting how drugs & devices are promoted & brought to market. Scrimmage wescrimmage.com @wescrimmage mobile learning platforms & sales enablement software to help reinforce training, improve speed to competency, & enhance sales productivity. Minneapolis, MN, USA based mobile learning company Scrimmage has been acquired by Canadian software company ACTO actoapp.com/actoscrimmage/ the companies announced 11-SEP-2020.",Active,https://actoapp.com,Canada,,,https://twitter.com/ACTOapp,https://www.crunchbase.com/organization/ACTO,,,https://betakit.com/acto-acquires-us-based-scrimmage-following-series-a/,7 May 2023
3,"""Act-On Software, Inc.""","act-on Software act-on.com @actonsoftware Act-On’s Adaptive Marketing Platform is your command center to get the right messages, to the right people, at the right time. Emphasizes the importance of not only providing a sales team with the right content & tools and aligning those assets with the buying cycle, but aligning the right tools with the right sales person. $70.5M in estimated revenue annually & competes with Hatchbuck, Percolate, & V Locators. Portland, OR / Scottsdale, AZ, USA & Reading, UK & India","Active,Rebranding",www.act-on.com,"UK,USA,India",,,https://twitter.com/actonsoftware,https://www.crunchbase.com/organization/act-on-software,,,https://www.owler.com/company/act-on,20 January 2023
,"""Ada Support, Inc.""","Ada Inc / Ada Support www.ada.support/ now www.ada.cx/ Former @adasupport now @ada_cx Chatbot platform that makes artificial intelligence accessible to non-technical support teams. It operates through both web & mobile machine learning engine that reduces support volume, empowers customers to find answers on their own, & automatically learns how to better serve customers in the future. $2M in estimated revenue annually & competes with Pandorabots, Dexter, & Passage AI. Toronto, ON, Canada. Ada Support Inc.","Active,Rebranding",https://www.ada.cx,Canada,,,https://twitter.com/ada_cx,https://www.crunchbase.com/organization/ada-support,,,,19 March 2022
4,Adobe,"Former ToutApp toutapp.com now within Adobe Marketo Engage: Adobe Systems Inc. agreed to acquire software maker Marketo Inc. for $4.75bn. 19-April-2017, Marketo had acquired ToutApp. ToutApp had $7M in revenue annually & used to compete with Velocify, Inc., Outreach, & SalesLoft.",Acquired,https://www.marketo.com,USA,,,,,,,,11 May 2023
4,Adobe,"Adobe: Adobe Firefly / Adobe Systems / Adobe Digital Publishing Suite (now part of AEM Mobile / Adobe Experience Manager Mobile). Create content like you always did for print, but publish to a tablet instead. If you need to make an emergency change to the app, your designers can push an update the same day. On Sep 20, 2018, Adobe Systems Inc. agreed to acquire software maker Marketo Inc. for $4.75bn. On April 19, 2017, Marketo had acquired ToutApp: $7M in revenue annually & competes with Velocify, Inc., Outreach, & SalesLoft.",Active,https://business.adobe.com,USA,"SaaS,ML","CMS,Document Generation,Content Editing",https://twitter.com/adobeexpcloud,,,B2B,,7 April 2023
,affinity,"Affinity affinity.co @Affinity. Affinity’s new Relationship Intelligence product for sales teams due out later 2020; Affinity expands to open Canadian office. Affinity relationship intelligence platform, announced the acquisition of Nudge, a revenue intelligence platform designed to build relationships & grow sales. Affinity (founded in 2014 just like Nudge) offers a platform that (using AI) collects & analyzes data to build better network relationships. Similarly, Nudge had developed an AI-based revenue intelligence platform for sales teams, used to identify gaps in stakeholder relationships, with the goal of finding & increasing pipeline attrition. nudge.ai (@nudgeai a social selling app that helps you grow the right relationships from your network of weak connections; Toronto, ON, Canada. Out of business as of 21-Jan-2020.) NUDGE.AI ASSETS ACQUIRED LESS THAN TWO MONTHS AFTER COMPANY SHUT DOWN: SAN FRANCISCO, CA; 11-Mar-2020, Nudge has been acquired by Affinity",Active,https://www.affinity.co/,USA,,,https://twitter.com/Affinity,,,B2B,https://betakit.com/nudge-ai-assets-acquired-less-than-two-months-after-company-shut-down/,12 August 2022
14,Bigtincan,"Agnitio A/S agnitio.com @agnitiomcm Digital engagement technologies for the life sciences. Empower sales teams, market access & medical affairs with the tools they need to succeed. Agnitio’s Rainmaker software empowers customer facing teams in life sciences to be successful in today’s digital & mobile world. Agnitio had estimated sustainable annualized recurring revenue (ARR) of A$1.6m AUD. Early October 2020, Bigtincan Holdings Limited (ASX: BTH) entered into a binding purchase for Agnitio (“SPA”) to acquire 100% of the issued capital of Agnitio A/S, a Danish company that provides a leading solution for remote selling for life sciences customers creating Digital Sales Rooms for customer engagements. Copenhagen, Denmark","Acquired,Active",https://agnitio.com,Denmark,,,https://twitter.com/agnitiomcm,,,,,28 April 2023
,Aimino Tech GmbH,"Aimino https://aimino.de AI-driven sales automation platform that enhances your CRM by offering personalized sales messaging, thereby increasing lead conversions & improving employee satisfaction. Multifunctional Sales Automation Tool; designed to assist your team in optimizing Lead Qualification & Conversion Rates - Fully Automated! Boost Your Lead Generation With Al-Powered Personalization: Aimino Tech GmbH, Karlsruhe, Germany",Active,https://aimino.de,Germany,"SaaS,ML","prospecting,outreach,Lead Generation",,,,B2B,,31 August 2023
41,"""DEMAND SCIENCE, LLC""","Airborne airborneapp.io @Airborneapp_io Sales Engagement for Agencies! Sales Engagement Platform for All of Your Agency Clients. Build automation for Email, LinkedIn & Telephone all on one platform. Sales Engagement platform built for Sales & Marketing Agencies. Manage multi-channel sequences via email, phone, & LinkedIn touches. Also known as Airborne. Airborne Apps Inc, Toronto, Ontario, Canada. 20-Jul-2021: Demand Science demandscience.com @DemandScience a revenue intelligence platform announced the acquisition of Airborne App, Inc. a Toronto-based sales engagement and enablement software platform. The acquisition is Demand Science’s sixth since August 2020, enhancing its global B2B data & intelligence solutions for sales & marketing professionals.","Acquired,Active",,Canada,,,https://twitter.com/Airborneapp_io,https://www.crunchbase.com/organization/airborneapp,,B2B,https://demandscience.com/demand-science-acquires-airborne/,18 January 2023
,Airdemos Pty Ltd,"Airdemos airdemos.com @airdemos Enterprise software demos: Airing Enterprise SaaS demos for SMB IT tech buyers, online & on-demand. Tech buyers skip the nonsense cold calls, discovery meetings & sale pitches. Focus on evaluating the software & its features! Allowing buyers to move quickly & confidently towards a purchase decision. Airdemos Pty Ltd. Sydney, NSW, Australia",Active,https://airdemos.com,Australia,,,https://twitter.com/Airdemos,,,,,6 October 2023
,"""Formagrid, Inc.""","airtable.com @airtable Creation guide for 5 essential pieces of content to help you drive deals, from start to close: offers.hubspot.com/sales-enablement-guide ebook. Sales Collateral Management. Made Flexible & Effortless‎. Manage case studies, call decks, & more with the ease of using a spreadsheet. 350+ App Integrations. Spreadsheet Interface. Used by 30,000+ companies. Realtime Collaboration. Drag & Drop File Uploads. Gallery & Card Views. Easy As A Spreadsheet. $20M in revenue annually. Competes with Basecamp, hopTo, & Trello. Formagrid, Inc., San Francisco, CA",Active,www.airtable.com,USA,SaaS,,https://twitter.com/airtable,,,,https://www.owler.com/company/airtable,19 April 2023
,,akordis sales akordis.com @akordis convince your clients of your expertise while you improve your selling skills. Out of business since end of 2017?,Out of Business,,,,,https://twitter.com/akordis,,,,,1 April 2022
5,Mediafly,"Alinean (See Mediafly below) alinean.com @AlineanROI powering B2B Value Selling & Marketing with interactive white papers, diagnostic assessments, ROI / TCO calculators. Founded in 2001 by Tom Pisello. October 25, 2018: Mediafly announced the acquisition of Alinean Inc. Tom will join Mediafly as Chief Evangelist & lead the advisory team in delivering everything from content workshops to deep digital sales transformation projects. Alinean & Mediafly recognize B2B buyers have changed, have become more digitally savvy & sophisticated, & that to stay competitive, sellers need to change along with them. Buyers aren’t looking for sellers to present static, boring pitch decks with product information they’ve already found online. They’re looking for sellers to bring additional value to sales conversations – to effectively communicate the impact their product or service will have on the buyer’s business in the context of what the buyer cares about. Winter Park, Orlando, FL",Acquired,,USA,,,,,30/4/2021,B2B,,19 October 2022
5,Mediafly,"Aptology aptology.com @APTOLOGY1 18-Oct-2022, Mediafly mediafly.com revenue enablement platform, has acquired Aptology aptology.com talent intelligence platform specializing in assessing & predicting sales rep performance. Aptology is Mediafly's sixth acquisition & the latest addition to the company's modular Revenue360 platform, which includes sales enablement, content management, coaching, value selling & revenue intelligence. San Francisco, CA, USA","Acquired,Active",https://www.aptology.com,USA,,,https://twitter.com/APTOLOGY1,https://www.crunchbase.com/organization/aptology,,B2B,,19 October 2022
6,"""Allbound, Inc.""","Allbound allbound.com @allbound SaaS toolset for partner training, content marketing, collaboration, & customer success. Deliver content & training. Ready reps for the entire sales cycle. Training & Learning Tracks to up your reps’ game. Playbooks & Pins to give reps specific content or see what content they’ve assembled. Customer-Facing Tools that help partners & their reps provide ongoing value, both pre- and post-sales. Empower your channel partners to have the conversations they need to have. Collaboration Spaces foster mutually-beneficial, profitable communication & prevent partners from spinning their wheels. Save valuable time with an organized, transparent thread of conversation. No time lost scouring inboxes for emails, no hours wasted on calls with partners half in the dark. Align knowledge across the board & enable representatives from all sides of a deal to share & discuss information in a collaborative environment, archived for everybody’s future reference. Channel Enablement / Partner Enablement. $7.3M USD in annual revenue. Competes with Highspot, Seismic, & Brainshark. Phoenix, AZ & San Francisco, CA, USA. 26-Jul-2022: $43M Private Equity from Invictus Growth Partners Invictus Growth Management LLC",Active,www.allbound.com,USA,SaaS,"Channel (Partner) Enablement,Sales Enablement",https://twitter.com/allbound,https://www.crunchbase.com/organization/allbound,,B2B,https://getlatka.com/companies/allbound,2 February 2023
