Field 1,Parent company,Vendor,Business status,link,Country of origin,Software type,Focus,Twitter,Crunchbase,Website shutdown date,B2B vs B2C,Financials,Last edit
,Leaner Technologies Inc,"Leaner leaner.co.jp @leaner_japan keep innovating on procurement standards! Leaner Technologies Co., Ltd. develops & provides the expenditure management platform Leaner with the mission of continuing to innovate procurement standards. Provides cloud-based software for cost reduction analysis. Leaner Quotation: A cloud service that digitizes the analog quotation process & realizes “sophistication of sourcing.” A cloud service chosen as the “first step” for procurement departments that want to change analog estimation activities. Can be introduced in as little as 1 month. Leaner Technologies Inc. Tokyo, Japan (Shinagawa City)",Active,https://leaner.co.jp,Japan,SaaS,,https://twitter.com/leaner_japan,https://www.crunchbase.com/organization/leaner-technologies,,B2B,,31 October 2023
154,Showpad,"LearnCore learncore.com/sales-enablement/ Sales training & coaching platform built with enablement in mind. Empower your sales teams. Increase Rep Productivity: Make sure the entire sales team is always up to speed & communicating consistently. Messaging, Demos, Objection Handling, Onboard Reps Faster. Deliver just-in-time learning to the right people at the right time. Chicago, IL Joined Showpad. LearnCore has become the new Showpad Coach. Deliver the onboarding, training, and coaching your salespeople need to become trusted advisors and exceed quota with Showpad Coach’s sales coaching and training software.",Acquired,https://www.showpad.com/product/showpad-coach/,,,,,,,,,20 January 2023
76,Learning Pool Ltd,"Learning Pool learningpool.com @LearningPool e-learning: online learning platforms, creative content & analytics. Solutions include traditional Learning Management Systems (LMS), next-generation Learning Experience Platforms (LXP), Learning Record Store (LRS), agile learning content development tools, off-the-shelf e-learning modules & bespoke content development. Learning Pool Ltd, Derry, UK. Competes with Totara Learning @totaralearning",Active,https://learningpool.com,UK,,,https://twitter.com/LearningPool,,,B2B,,23 May 2023
142,"Permira permira.com Global investment firm,Seismic","Lessonly lessonly.com/sales-enablement-training-software/ @lessonly “powerfully simple, trackable training software teams use to learn & practice like never before. Helps customer service & sales teams do better work.” Sales Enablement Training Software: With Lessonly, companies & managers quickly transform knowledge into shareable lessons & resources, engage employees through interactive feedback loops, accelerate rep & team performance, & measure the impact of better learning across their organizations. Lessonly has $6.7M in revenue annually. Lessonly competes with Mindflash, LearnCore (See above & see Showpad below), & TrainCaster LMS. Indianapolis, IN, USA. 19-Aug-2021, sales enablement & marketing orchestration platform Seismic acquired Lessonly, a provider of sales training, coaching, & enablement solutions. With this acquisition, the company will provide sellers the access to marketing & sales content as well as coaching plans, learning programs, & practice scenarios in one location. In addition to the acquisition, the company has also closed a $170M Series G funding bringing the company’s valuation to $3B. Obie acquired by Lessonly 29-Jul-2021","Active,Acquired",https://www.lessonly.com,USA,SaaS,,https://twitter.com/lessonly,https://www.crunchbase.com/organization/lesson-ly,,B2B,,14 May 2022
137,Salesforce,"LevelJump leveljump.io @LevelJumpS built on the Salesforce platform. Correlate all of your enablement efforts to real CRM metrics & milestones. Improve your onboarding process, maintain ongoing sales training, & drive revenue. Launch prescriptive & interactive programs that include videos, calls, articles, & coaching materials to continuously onboard & train your sales force in the most engaging way. Provide a modern enablement experience with onboarding, on-going training, new product launches, pre-event, & pre-campaign programs your teams can complete on the go. Practice with video-first coaching rooms assigned to your managers & teams for role play, pitches, & objection handling. Align sales & marketing message consistency by reviewing pitches, providing scores & feedback, and certifying your reps. Centralize training videos & coaching content in a library directly in Salesforce, & categorize by themes, win stories, or use cases. Accelerate deals with recommended content based on stage, products, competitors, or any custom fields on leads, contacts, accounts, & opportunities in Salesforce. Save reps time by linking additional resources to videos, from your CMS, to PDFs, & any other tools. Ramp reps faster by publishing training videos & coaching collateral to help them at any stage of the sales cycle. Toronto, ON, Canada. Acquired by Salesforce 22-Sep-2021","Rebranding,Active,Acquired",https://www.leveljump.io,Canada,SaaS,Sales Enablement,https://twitter.com/LevelJumpS,,,B2B,,23 May 2023
154,Showpad,LIA liaapp.com mobile app that pushes correct sales materials to each rep & then sends analytics back to management to help sales & marketing be more effective together. Old brand: LiberatedIntelligence.com Digital Asset Manager. LIA acquired by Showpad. liberatedintelligence.com old brand of LIA liaapp.com (Now Showpad),"Rebranding,Acquired",https://www.showpad.com,USA,,,,,,,,20 January 2023
83,Microsoft,"LinkedIn (Microsoft) (See PointDrive) PointDrive acquired by LinkedIn. Announced Date: Jul 26, 2016 May 3, 2012: LinkedIn acquired professional content sharing platform SlideShare for $119 million in cash & stock. Dec 8, 2016, after getting final European Commission approvals, Microsoft & LinkedIn announced that Microsoft’s $26.2bn acquisition of LinkedIn, the social networking site, officially closed. LinkedIn Learning / LinkedIn Marketing Solutions. LinkedIn Learning / LinkedIn Marketing Solutions (Microsoft) Microsoft microsoft.com @microsoft getting into the metaverse & its corporate version of the metaverse via Microsoft Teams & rolling out updates to Xbox consoles: Collectively known as Mesh: Combines the mixed-reality capabilities of Microsoft Mesh, people in different locations join collaborative & shared holographic experiences, with productivity tools of Microsoft Teams, where people can join virtual meetings, send chats, collaborate on shared documents etc. Microsoft has Loop as a Notion clone for Office: “The Fluid Framework is coming to life as Microsoft Loop, a new Microsoft 365 application that takes collaboration beyond the traditional document”. Microsoft makes SharePoint, Microsoft CRM Dynamics 365, Microsoft Azure the cloud computing service, owns Yammer / Skype / LinkedIn (PointDrive) PointDrive acquired by LinkedIn 26-Jul-2016 / LinkedIn Learning. 3-May-2012, LinkedIn acquired professional content sharing platform SlideShare for $119M. 8-Dec-2016, Microsoft & LinkedIn announced that Microsoft’s $26.2bn acquisition of LinkedIn, the social networking site, officially closed. 11-Aug-2020, LinkedIn sold the presentation-sharing service scribd scribd.com @Scribd Scribd Inc. began operating the SlideShare slideshare.net @SlideShare business on 24-Sep-2020. Microsoft Office Delve: Cloud-based service powered by Office Graph, which helps users find & discover pertinent information across integrated Microsoft products by pulling user content from Microsoft Exchange, OneDrive for Business, SharePoint 2016 & Yammer. Greg Poirier of Cloudkettle says: ""I spend a lot of time with startups. We tell them all that Excel is your worst competitor. Everyone already has it (no new cost), they kind of know how to use it (no onboarding) and it’s very reliable (in general startup software is not). It’s a startup killer.""","Acquired,Active",https://linkedin.com/learning/,USA,,,,,,,,27 March 2022
,"""Lionboard Analytics, LLC""","Lionboard Analytics, LLC lionboard.com Saas-based Analytics Platform & Benchmarking Solution for Sales Enablement founded 2017. Helping Sales Enablement Leaders prove their financial value & elevate their conversation with their executive team, to help them transition from a tactical pursuer of “random acts of enablement” to become an influential voice in the formulation & execution of their company’s Go-To-Sale Strategy. Connects the dots between sales enablement & a company’s financial performance. Presents that information in a simple, “fitbit-like” dashboard that can show the value of the sales enablement team. Hence, it’s not adding to the number of sales rep facing tools. Palatine, Greater Chicago Area, Illinois, US","Zombie?,maintenance mode company?,Out of Business",https://www.lionboard.com,USA,,,https://www.linkedin.com/company/lionboard-analytics/about/,,,,https://www.linkedin.com/company/lionboard-analytics/about/,23 February 2022
,,"LiveHive livehiveapp.com @LiveHive allows channel managers to gain live insight into partner selling activities. iOS app / single destination to get the most current business documents, campaigns and product materials and then analyzes who is using what & which materials are most helpful to channel partners. San Jose, CA, US (Last tweet was 5-May-2017 and website is down)",Out of Business,,USA,,,,,,,,16 October 2022
,thedocyard Limited,"LockBox Storage lockboxtech.com.au – a B2B secure document storage & sharing solution customers can integrate into their digital offerings. thedocyard thedocyard.co @thedocyard_co deal management platform in a single integrated solution that empowers teams, drives productivity & manages risk. Cloud-based deal space built specifically for managing the entire lifecycle of any corporate or commercial transaction. Project documents, communication & management in one place. Your organisation-wide solution for internal & external collaboration between all deal stakeholders, on both sides of the deal. Secure document management, version control, watermarking, e-signatures & a complete audit trail of all users’ viewing, downloading & commenting on each document. thedocyard acquired 100% of LockBox Technologies Pty Ltd. LockBox is an Australian technology company that has created two complementary products: LockBox & Athena Board athenaboard.com.au – a direct to customer secure document creation & consumption solution for boards. Sydney, NSW, Australia",Acquired,https://www.lockboxtech.com.au/,Australia,,,,,,,,16 October 2022
79,KLI Learning Corporation,"LogicBay logicbay.com @LogicBay cloud-based partner relationship management (PRM) solutions for small emerging to global enterprises. Also offers consulting, training, & certification solutions. “Accelerate revenue with LogicBay’s Partner Relationship Management (PRM) Solution.” $4.1M in revenue annually. Competes with Channeltivity, Relayware, & ChannelAdvisor. Founded in 1980. LogicBay was acquired by KLI Learning Corporation on Feb 1, 2004. Based in Warwick, Rhode Island. Wilmington, North Carolina, USA","Acquired,Active",https://www.logicbay.com,USA,,,https://twitter.com/logicbay,https://www.crunchbase.com/organization/logicbay,,,,23 February 2022
114,"Loom Inc.,Atlassian Corporation Plc","Loom loom.com @loom work communication tool that helps you get your message across through instantly shareable video. Say it with video! Get your message across, no matter where you work. Sending a Loom is more efficient than typing long emails or spending your day in meetings having conversations that don’t need to happen in real-time. You talk up to 6x faster than you type. Capture you screen, record their front-facing camera, & narrate video all at once with no switching apps or upload required. Whether it’s training new teammates or replying to a customer inquiry, Loom enhances the way people communicate at work by allowing them to send the next best thing to being there. Why Sales teams use Loom: Improve outreach. Accelerate sales cycles. Optimize performance. Streamline onboarding. San Francisco, CA, USA. Legal name Opentest, Inc. 13-Oct-2023: Atlassian to acquire video-messaging startup Loom for $975M.","Active,Rebranding,Acquired",https://www.loom.com,USA,SaaS,video,https://twitter.com/loom,https://www.crunchbase.com/organization/loom,,"B2C,B2B",,13 October 2023
,,"Loop helloloop.io @helloloop Helping sales teams onboard sales reps more effectively. Loop helps sales teams generate more revenue through more effective onboarding. Loop was born out of the desire to create a sales process where anyone can sell anything without deep experience. Brooklyn, New York, USA",Out of Business,,USA,SaaS,"training / onboarding,learning management system",https://twitter.com/helloloop,https://www.linkedin.com/company/helloloop/,13/10/2023,B2B,https://www.linkedin.com/company/helloloop/,13 October 2023
81,Loopio Inc.,"Loopio loopio.com @loopioinc Proposal & RFP Management Software: simplifies the process of developing proposals and responding to RFPs. Automation engine to populate your RFP with the best answers from your Loopio Library. “Produce brand compliant proposals in seconds: Don’t spend countless hours formatting documents. Leave it to Loopio to export your content into a beautiful, custom branded proposal.” $20M in revenue annually. Competes with RFPIO Inc., RFP365, & Proposal Software. Toronto, Canada. 17-May-2023, Loopio acquired Avnio [Avnio Ltd] https://www.avnio.com a 100% Salesforce-native Response Management solution, which streamlines the process of responding to RFPs, RFIs, & questionnaires inside the world’s most-used CRM. https://twitter.com/avnioltd",Active,https://www.loopio.com,Canada,SaaS,RFP,https://twitter.com/loopioinc,https://www.crunchbase.com/organization/loopio,,B2B,,6 June 2023
81,"Loopio Inc.,Avnio Ltd","Loopio loopio.com @loopioinc 17-May-2023, Loopio acquired Avnio [Avnio Ltd] https://www.avnio.com https://twitter.com/avnioltd a 100% Salesforce-native Response Management solution, which streamlines the process of responding to RFPs, RFIs, & questionnaires inside the world’s most-used CRM. Avnio is a Sales Control and Acceleration Platform dedicated to creating amazing solutions and products for sales teams. Avnio Response Cloud is the only Salesforce native, fully-automated response solution designed to help you win more of the right business by automating the response, capture, and analysis of RFPs, DDQs, and Security Questionnaires. London EC1A 2BN United Kingdom","Acquired,Active",https://www.avnio.com,UK,"SaaS,Salesforce.com Package",RFP,https://twitter.com/avnioltd,https://www.crunchbase.com/organization/loopio,,B2B,https://www.newswire.com/news/loopio-acquires-avnio-expanding-global-presence-and-broadening-22038914,6 June 2023
,Loxo Limited,"Loxo loxoapp.com Sales enablement for buyer-obsessed companies. Stand out to your prospective customers with Loxo, the fastest way to enable your buyers to sell internally, & ensure consistent execution from your reps. Accelerate your revenue growth by making it easier for buyers to buy from you. Digital Salesrooms like you have never seen before. Loxo is a prospect engagement platform for SaaS Account Executives. It allows AEs to create private mini-sites that host all the info their prospects will need in one place. This makes it easier for their prospects to communicate a world of info to different decision-makers & executives – helping them get internal buy-in. Instead of forwarding 20-page PDFs, videos, slide decks, mutual action plans, and more (all as individual files), AEs can quickly create central hubs that host all these assets in one place. Then, all their prospect has to forward is one URL to their internal stakeholders. By decluttering the post-demo process, Loxo makes it easier for your prospect to get internal buy-in, so you can prevent deals from slipping. Loxo Limited. London, UK",Active,https://www.loxoapp.com,UK,SaaS,,,,,B2B,,4 October 2023
137,Salesforce,"Lurniture (See LevelJump above) Lurniture lurniture.com Accelerate your sales by delivering the right sales training at the right time — right within Salesforce. Develop your team’s selling skills faster, Increase deal sizes & close rates, Clone your top performers, Track the ROI of your training efforts. Built 100% native on salesforce.com (SFDC), Toronto, Ontario, Canada. Acquired by Salesforce 22-Sep-2021","Out of Business,Rebranding,Acquired",https://www.leveljump.io,Canada,,,,,,,,23 May 2023
,Lusha Systems Ltd.,"Lusha lusha.com @LushaData B2B engagement is based on trust. Lusha helps you build that trust. Israeli startup [First U.S. office in Boston] that helps B2B salespeople identify, engage with & close deals. Similar to ZoomInfo, Lusha’s cloud-based platform helps sales teams share accurate contact & company information with each other, & provides them with data they can use to better understand the customers they target. It also recommends relevant prospects, eliminating the cumbersome research process that often bogs salespeople down. Lusha Systems Ltd.",Active,https://www.lusha.com,Israel,"ML,SaaS",Lead Generation,https://twitter.com/LushaData,,,B2B,,4 September 2023
,MadKudu Inc.,"MadKudu madkudu.com @madkudu predicts the value of every lead in the funnel, helping marketing leaders assess their marketing programs & adjust spend. Give them a forward-looking view of their pipeline & ability to articulate their value with a metric everybody understands & trusts: expected revenue. Helps B2B marketers take full advantage of their valuable data to empower their go-to-market strategy. Automatically prioritize your best leads & accounts based on fit & intent, ensuring nothing falls through the cracks & you aren’t leaving revenue on the table. Connect Data From Everywhere: How a lead engages with your product is just as important as the website, your emails, or sales conversations. MadKudu ingests data from ALL sources. By measuring & talking the language of the rest of the company – revenue – you’ll prevent questions about the impact of your marketing team, saving energy for more productive conversations. MadKudu Inc., Mountain View, CA",Active,https://www.madkudu.com,USA,,,https://twitter.com/madkudu,,,B2B,,11 May 2023
136,"""Pipedrive, Inc."",Vista Equity Partners","Mailigen mailigen.com @mailigen (Acquired by Pipedrive) email marketing automation platform & agency servicing small to medium size companies around the world. Email marketing comes to Pipedrive. Mailigen by Pipedrive will open to the first users later spring 2020. Get ready to engage your customers and make entirely new ones with Mailigen by Pipedrive. Riga, Riga, Latvia","Acquired,Active",https://www.mailigen.com,Latvia,,,https://twitter.com/mailigen,https://www.crunchbase.com/organization/mailigen,,,,16 October 2022
80,Ricoh Group,"MarcomCentral acquired by Ricoh Company on Dec 9, 2014 marcom.com @MarcomCentral an online, on demand marketing assets management (MAM) solution. ""Become a marketing rockstar with MarcomCentral's marketing asset management software."" Manages & customizes marketing content across your entire organization. $10M in estimated revenue annually& competes with Pageflex Inc., SproutLoud Media Networks, LLC, & Elateral. Solana Beach, California, US","Acquired,Active,Rebranding",https://marcom.com,"USA,Japan",,,https://twitter.com/MarcomCentral,https://www.crunchbase.com/organization/marcomcentral,,,https://www.owler.com/company/marcom,23 February 2022
4,Adobe,"Marketo (acquired ToutApp) See Adobe Systems. Marketo has $308.5M in revenue annually & competes with Act-On Software, Pardot, & HubSpot. Sep 20, 2018: Marketo acquired by Adobe Systems (for $4.8B). Combine Marketo Engage with Adobe Experience Cloud for everything you need, from AI-driven analytics to content optimization at scale, to bring world-class experiences to every single customer.","Acquired,Active",https://www.marketo.com,USA,,,,,,,,11 May 2023
87,"""Matik, Inc.""","Matik matik.io @Matik_io automates the generation of repetitive data-driven presentations, so reps can spend more time selling & less time on tedious tasks. Generate personalized customer presentations in minutes, not hours! Automatically generate native Google Slide or PowerPoint presentations with customized data inputs. Automatically extract data from your CRM, BI dashboards, or any database to infuse data driven insights into your templates. San Francisco, CA",Active,https://matik.io,USA,,,https://twitter.com/matik_io,,,,,23 February 2022
5,Mediafly,"Mediafly mediafly.com @mediafly offers sales & marketing a selling experience that values the buyer & drives business growth. Ensures sales teams, partners, & customers have immediate & secure access to the latest sales & marketing materials, online or offline. Chicago, IL (25-Oct-2018, acquisition of Alinean Inc. (See above). B2B buyers changed / became more digitally savvy & sophisticated. To stay competitive, sellers need to change along with them. Buyers aren’t looking for sellers to present static, boring pitch decks with product information they’ve already found online. They’re looking for sellers to bring additional value to sales conversations – to effectively communicate the impact their product or service will have on the buyer’s business in the context of what the buyer cares about.) $18.4M in revenue annually & competes with Showpad, Brainshark, & ClearSlide. On the SAP App Center: Mediafly for SAP Sales Cloud. Sell more effectively by giving customers a more personalized, interactive & data-driven experience. Gives your team a single, mobile-ready repository for distributing, managing & accessing all your current marketing content, in all formats – documents, presentations, audio, videos, PDFs. The right content is far faster & easier to find & use, saving time & administrative headaches. After content is shared, it is automatically tracked, so managers know what’s working. Content can be moved from any existing system into Mediafly. Once incorporated, users can work with the Mediafly App right within SAP Sales Cloud. Recommends content based on the stage of sales cycle, applying metrics drawn from how your materials perform against closed sales. Recommended content helps sales reps use the right content at the right time, in the moment during sales presentations. It can also be used for internal coaching & developing sales best practices, & by marketers/ managers to plan future content pieces that can most effectively support sales. 5-Sep-2019, Mediafly acquired iPresent Ltd. Mediafly Content Hub announced July 2020: A solution providing marketers the ability to manage public-facing website sales content, customer-facing sales content & internal-only sales content all in one place, allowing teams to share relevant, engaging & personalized content throughout every stage of the buying process. Content Hub & the suite of sales enablement & content management solutions positions Mediafly as a sales enablement technology provider to support the entire buyer journey in one platform, enabling a consistent, personalized & engaging sales content experience from a buyer’s first interaction with a brand through to conversion & post-sale. The typical B2B buyer is already 57% through the purchase process before reaching out to sales. This makes the content that buyers self-discover online a critical component of the sales process. To win attention / new customers, companies must offer a consistent, premium, end-to-end sales content experience that guides a buyer from education to purchase. This flow is typically obstructed by sales & marketing content housed in disparate, non-communicative systems that fail to leverage the collective insights that guide buyers toward confident purchase decisions. CHICAGO, 28-Oct-2020, Mediafly, a provider of sales enablement technology, content management & advisory services that create interactive, value-based selling experiences, announced it acquired Presentify, a global visual communication solution based in the UK. 21-Nov-2020, Mediafly launched Jumpstart Presentations, a new offering to help brands accelerate their digital sales transformation & move beyond the traditional pitch presentation. Mediafly introduced Shadow Content Finder, a feature that helps organizations identify and track the performance of seller-generated content (vs. marketing-approved content) to understand what resonates with customers and improve future content strategy. As content usage and consumption remains a key driver of innovation at Mediafly, Shadow Content Finder was designed to increase visibility into seller-generated content that moves deals forward during sales interactions. The feature extracts content performance insights that marketers may not otherwise be aware of. 18-Oct-2022, Mediafly mediafly.com revenue enablement platform, has acquired Aptology aptology.com talent intelligence platform specializing in assessing & predicting sales rep performance. Aptology is Mediafly's sixth acquisition & the latest addition to the company's modular Revenue360 platform, which includes sales enablement, content management, coaching, value selling & revenue intelligence. USA. 27-Apr-2022, Mediafly @Mediafly is acquiring ExecVision. Mediafly, a sales enablement & revenue intelligence platform provider, has acquired ExecVision, a conversation intelligence (CI) provider. Financial terms of the deal were not disclosed.",Active,https://www.mediafly.com,USA,SaaS,Sales Enablement,https://twitter.com/mediafly,https://www.crunchbase.com/organization/mediafly,,B2B,,22 December 2022
