Field 1,Parent company,Vendor,Business status,link,Country of origin,Software type,Focus,Twitter,Crunchbase,Website shutdown date,B2B vs B2C,Financials,Last edit
,Crikle Ltd,"Crikle crikle.com @CrikleApp remote selling platform. Make more sales: Crikle’s game-changing remote selling solution combines all your essential sales tools into a single browser screen. Web-based sales solution that combines video calling with customised sales guidance and actionable information capture, to sell quickly. High-definition presenting. Branded video meetings. Sync with CRM. Recording with time stamping. Customisable sales checklists. Shared content library. Less admin, more selling: Get your hands on this priceless time hack so your team can spend more of their time selling (remotely). Are you paying attention? When you’re too busy scribbling notes or distracted whilst switching screens, you lose that crucial face-to-face connection with your prospect. Crikle ensures you stick to the golden rule of sales – focus on the customer. Crikle Ltd. London, UK",Active,https://www.crikle.com,UK,,,https://twitter.com/crikleapp,,,,,2 May 2023
,Cronycle Ltd,"Cronycle cronycle.com @cronycle Knowledge sharing workspace to foster learning & innovation in the enterprise & for the public. Grow knowledge, expertise & authority. Discover, curate, share & act on knowledge – all in one workspace. Discover & source content to grow knowledge. Monitor your industry vertical news. Engage your organization on learning. Inform audience with newsletters. Curate for content marketing & SMM: Save time when you source, collect, organize, & share marketing curated content for your website, newsletters & social media. Save to boards to organize, make sense of & enrich content. Summarize, tag, annotate & discuss content – alone or with your team. Advanced filtering & full text search. Cronycle Ltd, London, UK",Active,https://www.cronycle.com,UK,,,https://twitter.com/cronycle,,,,,2 May 2023
,Curious Thing Pty Ltd,"CuriousThingAI curiousthing.io @CuriousThingAI Curious Thing: Conversational AI for digital experiences/conversations. The platform has you covered from startups to enterprises. A conversational AI engine, powered by natural language processing (NLP), knowledge graph, & deep transfer learning. Imagine what you could do with an AI that makes calls just like us… Transform the way you engage with your customers using voice-based conversational AI. Our platform goes far beyond the limitations of a basic voice AI assistant. We can make outgoing warm calls & have real-time. Customer re-engagement: Offer inactive customers special deals, ask for feedback & much more. conversations with your customers. Customer surveys: Improve by getting feedback about your products & services. Wellness check-ins: Check-in before & after surgery, monitor medication use & more. Payment reminders: Send upcoming payment reminders & follow up on defaulted bills. Introduce new products: Keep customers informed of your new products & services. Shopping cart nudges: Remind customers about abandoned carts & give extra incentive to buy. Sydney, NSW, Australia. Curious Thing Pty Ltd","Active,Pivoted",https://www.curiousthing.io,Australia,ML,"eCommerce,outreach",https://twitter.com/CuriousThingAI,https://www.crunchbase.com/organization/curious-thing,,,https://www.crunchbase.com/organization/curious-thing,17 May 2022
36,Zoomifier,"CustomShow customshow.com @CustomShow (""a Zoomifier company"") presentation software that allows to build custom branded presentations that look better than your typical PowerPoint presentation while still incorporating important metrics & reporting needed for sales teams to track engagement. Create customized & branded presentations while equipping teams with access to a slide library in a fully cloud-based environment. Incorporates analytics, the ability to conduct web meetings, integration with SalesForce.com, all while customizing to your own brand standard. $6.2M in estimated revenue annually & competes with ClearSlide, iPresent, & Prezi. On April 1, 2019, Zoomifier Corporation completed the acquisition of the presentation software assets of CustomShow Inc. New York, NY, USA",Acquired,https://www.customshow.com,USA,,Sales Enablement,https://twitter.com/CustomShow,,,,,2 May 2023
,CUVAMA LIMITED,"Cuvama https://cuvama.com guides GTM teams to discover customer pain, sell outcomes & reinforce success. Customer Value Discovery platform, guiding Sales & Customer Success with your unique value proposition to uncover customer pain, sell outcomes & reinforce success. B2B Sales & Customer Success are failing to connect with customers. Customers don’t want to buy more products. Customers want a solution to their problem & a positive business impact. They want value. But Sales & Customer Success reps struggle to meet this need. With less money to spend, customers now only buy & renew with providers that can sell & deliver value. Providers that don’t do this are failing to win & retain customers. B2B GTM teams need to focus on better uncovering customer pain, selling based on outcomes, & reinforcing success. They need to focus on Customer Value. Cuvama CVM: Cuvama is a value selling tool that enables even the most average of reps to be a credible expert and sell business outcomes, not products. Guides all your reps to have the right value conversation in real-time. We enable them to be an expert in your value prop and dynamically link a buyer’s challenges to the business impact your solution will drive. Unlike your existing…Discovery guide, Cuvama is dynamic & real-time. Sales enablement: Cuvama actually helps reps in live conversations. Buyer Enablement: ROI calculator, Cuvama is customer facing & collaborative. Cuvama can be used across all deals by all reps. CUVAMA LIMITED",Active,https://cuvama.com,UK,,,,,,B2B,,8 September 2023
,CXera LLC,"CXera cxera.com @CXeraLLC from first contact to customer success. digital customer experience (CX) microsites. How we do business in today’s digital sales & service economy has changed for virtually every organization. To get it right, you need a digital approach that supports customers from first contact to their success & with a digital approach you can enable sales & services success while also improving the customer’s experience at every point in their journey. CXera produces digital micro-sites that we call Experiences in minutes in order to deliver & track great customer experiences, every time. Not a platform & won’t take weeks or months to deploy. Our cloud-based application is engineered to make the digital age of selling & buying easy—with no technical expertise required. This is made possible by integrating with many popular cloud-based solutions & using Experience templates that are fully customizable through our Experience creation wizard. In minutes, design, populate & launch Experiences to your staff & customers to make a difference starting today. Ready-made Experience templates make it easy to create Experiences in minutes. AI-driven CXassistant makes recommendations &, if permitted, takes action to optimize Experiences. CXera offers built-in integrations with your company’s website & popular services. Sales Enablement + Customer Enablement = Revenue Enablement! Expanding the scope of sales enablement to include customer facing roles as well as the customer. Why enable customer facing roles & the customer directly? Research from Gartner supports the need: The sales enablement market has broadened beyond sellers to include the enablement of people in revenue-generating roles such as customer success, presales & marketing. An individual sales rep may often receive only 5% of a prospect’s direct time. 60% of frontline sales enablement companies are predicted to shift to enabling additional customer-facing roles over the next three years. By 2025, 25% of organizations will create a formal cross-functional counsel to align customer-facing teams that will provide recommendations, governance & oversight across the entire revenue process. Remove silos, become customer centric, and eliminate the fluff. Do not wait to drive the latest evolution of enablement. Onboarding the first product purchased by the customer is only the beginning. CXera LLC. Edina, MN, US",Out of Business,,USA,,,https://twitter.com/CXeraLLC,,29/8/2023,B2B,,29 August 2023
37,dink bvba,"d!NK dink.eu @dINK_sales Sales library on tablets enables customer facing staff to adapt interactions with customers/prospects to what interests them. Makes sales more effective; better qualification, condensed sales process. SalesMatik, d!nk’s sales enablement suite, is now available in Microsoft AppSource. Vosselaar, Antwerpen, Belgium",Active,https://www.dink.eu,Belgium,,,https://twitter.com/dINK_sales,https://www.crunchbase.com/organization/dink,,B2B,,2 May 2023
,Daisee Pty Ltd,"Daisee daisee.com @daisee_ai artificial intelligence software company that builds cutting edge AI applications for business. Lisa: AI-driven speech analytics that drives compliance in every conversation with your customers. Increased Revenue: Identify cross-sell & up-sell opportunities, Predict sales success, Increase customer satisfaction, Identify new commercial opportunities from conversational data. Compliance remediation, Individual agent & team training, Brand experience improvement, Key metrics improvement (AHT, FCR), Customer satisfaction improvement, Customer buying predictors, Agent & customer churn predictors. Bridging the gap between technical AI & commercial application for businesses worldwide. Lisa is an enterprise-ready speech analytics solution built with the future in mind delivering ROI to business from day one. Platform agnostic working with the appropriate telephony provider for each client. St Leonards, Sydney, NSW, Australia; Melbourne, VIC, Australia & Palo Alto, CA, USA",Active,https://www.daisee.com,Australia,"ML,SaaS",,https://twitter.com/daisee_ai,https://www.crunchbase.com/organization/daisee,,B2B,,29 September 2022
,"""Dashworks Technologies, Inc.""","Dashworks dashworks.ai @DashworksAI Unlock your company's collective knowledge. A unified hub for all your people, tools, & knowledge. Dashworks allows teams to instantly search anything across all their cloud & web applications. Fast-growing teams rely on Dashworks to find the answers they need when they need them. Rethink knowledge management from the ground up. Company know-how is scattered across hundreds of apps. Finding information inside the company takes ages. No way to discover & stay updated with what other teams are working on. Documentation that's impossible to keep organized. No single source of truth for internal knowledge. Documentation that's stale, duplicate, or without owners. Automate knowledge management: Connect all your applications like Slack, Google Drive, & Salesforce to Dashworks within seconds & instantly create an intelligent source of truth for your entire company. Empower everyone with the information they need: Transform how your team finds, discovers, & learns from your company's knowledge, & accelerate their onboarding. Break organizational silos: Align all functions in your company on a single view of your customers, projects, playbooks, teams, policies, & everything else. Dashworks Technologies, Inc. Formerly Known As Luminaire, Redwood City, CA, USA",Active,https://dashworks.ai,USA,SaaS,,https://twitter.com/dashworksai,https://www.crunchbase.com/organization/dashworks,,B2B,https://pitchbook.com/profiles/company/433404-91#overview,4 May 2023
,"""Databook Labs, Inc.""","Databook trydatabook.com @trydatabook enterprise customer intelligence platform built to increase GTM productivity at scale. Helps sales leaders empower teams for maximum performance, productivity, & pipeline. Automated sales presentations: Personalized deliverables, fast & easy. Databook’s automated sales modules help you create custom, data-driven content in record time. Databook’s solutions for a variety of automated sales deliverables are time-savers that kick productivity into overdrive. One-click downloads, customized for everything from first calls to executive briefings, ensure consistent points of view are shared with influential buyers. At the same time, higher sales productivity means more Account Execs meet quota & pipeline remains consistent. Sales teams at Salesforce, Microsoft, Databricks, & many other of the biggest, fastest-growing software companies in the world leverage Databook to sell their largest deals & consistently beat quotas. Sales reps transform into strategic sellers, identifying lucrative opportunities & driving pipeline at the executive-buyer level. Databook is a Series B, hyper-growth startup, backed by the most successful SaaS investors, such as Bessemer, & has recently raised a $50m round to fuel accelerated expansion. Headquartered in Mountain View, CA with a distributed team across the globe. Databook Labs, Inc., Palo Alto, CA, USA. 16-Feb-2022, Databook valuation hits $550M for its sales prospect intelligence software. Databook competitors include Brew, Crayon, & Klue.",Active,https://trydatabook.com,USA,SaaS,Sales Enablement,https://twitter.com/trydatabook,https://www.crunchbase.com/organization/databook,,B2B,https://getlatka.com/companies/databook,3 June 2022
38,Data Dwell Limited,"Data Dwell datadwell.com @data_dwell appexchange.salesforce.com listing: https://t.co/xNTxJOVjLa Enables sales & marketing teams to close deals faster by using intelligent content matching & measuring content ROI. The best content, analytics & prospect tracking, native in Salesforce. Increase sales conversion by dynamically matching relevant content to any prospect attributes. Generate relevant conversations, track detailed content consumption & notify sales of interactions in order to focus sales efforts – all in Salesforce. City of London, London & Reykjavík, Gullbringusysla, Iceland",Active,https://datadwell.com,"UK,Iceland",,,https://twitter.com/data_dwell,https://www.crunchbase.com/organization/data-dwell,,,,18 December 2022
,"""Datalead AI, Inc.""","Datalead AI datalead.ai @DataleadAI Enrich your business & reach to new heights! Helps sales teams to find new clients & get their foot in the door. https://datalead.ai/solutions/sales/ Instantly fetch qualified leads: A data-driven approach to lead generation that will revolutionize the way you do business, with billions of leads at your fingertips, hidden gems on targets, and suitable and meaningful insights on each one. We combine unique methods to provide you with the most updated details, contact details, working history, and social circles of your leads. Founded 2020. Datalead AI, Inc., Tel Aviv, Israel",Active,https://datalead.ai,Israel,ML,,https://twitter.com/DataleadAI,,,B2B,,1 May 2023
,Connectmedica LLC,"DBE getdbe.com complete next-generation marketing & sales enabled knowledge transfer solution. DBE is a fast & cost effective rapid content creation tool, distribution framework & customer focus content live presentation tool. The key features of DBE are video commentary & a multi-path meeting scenario. With non-linear presentations your salesforce is finally enabled to have a more successful sales conversation. Warsaw, Poland (Decision Based Education is a Connectmedica invented, innovative tool which redefines the way that educational meetings are being handled. What’s the basis of its originality? DBE is a system that allows learning based on real-time decision-making.)",Active,https://www.connectmedica.com,Poland,,,https://twitter.com/connectmedica,,,,,20 January 2023
39,DealHub Ltd.,"dealhub dealhub.io @dealhubio formerly Valooto valooto.com. Sales Engagement Platform that delivers a personalized buying experience at every step of sales & prospecting funnels. Enables Sales reps & buyers to meet, engage & collaborate online on relevant, personalized & dynamic content, while gaining real-time insights on buyer engagement & disposition. dealhub.io “CPQ / CLM / E-signature – Sales Engagement Platform. Featuring native integrations with Salesforce & Microsoft Dynamics CRM.” Operates natively on Salesforce & other leading cloud-based CRMs. Offering: Predictive Sales Playbooks, Interactive content sharing & engagement, Real-time engagement analytics, Configure-Price-Quote (CPQ), Document Generation, Contract Management & redlining, E-signature. DealHub.io raised a total of $4.5M in funding over 2 rounds. Main Office: Los Altos, CA. Other office: Israel","Rebranding,Active",https://dealhub.io,"Israel,USA",,,https://twitter.com/DealHubIO,https://www.crunchbase.com/organization/dealhubio,,,,1 May 2023
40,XFactor.io Corporation,"DecisionLink decisionlink.com @decisionlink Build Pipeline, ROI Analysis, Business Case Development & Market Analysis with Value Cloud, Enterprise Class Value Selling Automation Tool. Addressing the entire Buyer Journey & Customer Lifecycle, it is an integrated application delivering Repository & foundation for enterprise selling, Get smart about accounts in minutes, Understand your value in minutes, Value Propositions – to quantify, articulate & defend your value, & close deals, Defend your customer base, & sell them more. Used to compete with Alinean, VisualizeROI, & ion interactive. $3.1M in estimated revenue annually & competes with QuickPivot, Keap, & Pegasystems. Atlanta, GA, USA. SAN FRANCISCO: April 17, 2023, XFactor.io, the AI-powered go-to-market platform, announced the acquisition of DecisionLink, secure, SaaS-based customer value management solutions. The integration of the two platforms will support XFactor.io's mission to build, scale, & deliver a suite of go-to-market solutions. XFactor.io Corporation https://www.xfactor.io","Active,Acquired",https://www.xfactor.io,USA,,,https://twitter.com/decisionlink,https://www.crunchbase.com/organization/decisionlink,,,,8 September 2023
,BriefBid Inc.,"DeckLinks DeckLinks.com @deck_links B2B SaaS created to make sales more conversational. Helps sales teams securely share sales decks & instantly access engagement analytics to close more deals faster. BriefBid briefbid.com @briefbid launched DeckLinks, a platform that helps sales teams share interactive sales decks & access instant analytics on buyer engagement; positioning DeckLinks as Google Analytics for sales decks. It offers analytics for deck sharing & is a new stand-alone product that was inspired by key-learnings from the BriefBid’s B2B marketplace, which serves media buyers & sellers through RFP management & matchmaking. They saw sell-side users often sharing one-directional, static sales decks that failed to garner responses / feedback. Through an effort to understand how their buy-side users engage with sales material in the marketplace, the company developed tools to track interactions with their own sales decks to their users. “In our effort to solve a problem in the media RFP space, we discovered a problem in the sales space. When we thought we were solving a problem for our users, we ended up solving a problem for sales people in general. Sometimes great products come out of internal tools that can be applied externally […].” The DeckLinks platform is capable of showing sales reps how buyers specifically interact with sales materials, even when no direct response is provided. Allows sales teams to start more conversations with relevant follow ups, access actionable insights to improve their efforts, & close more deals by personalizing client experiences. Goes beyond traditional document sharing platforms by creating a custom, fully-trackable microsite that houses each deck. Features include company profiles, industry-specific modules, & other widgets. TORONTO, ONTARIO, CANADA",Active,https://www.decklinks.com,Canada,SaaS,"Sales Enablement,Buyer Enablement",https://twitter.com/deck_links/,,,"B2B,B2C",,20 February 2022
,Decktopus Inc.,"Decktopus decktopus.com @decktopus create presentations, sales sheets, portfolios & many more with the auto-adjusted layouts in an extremely short time. Don’t waste time formatting. Focus on your content. Out of the ordinary presentation tool: Create not only presentations but also proposals, bio links (decktop.us your bio: Create a link connecting your audience to all your content! Seems to be aiming to become the linktree of b2b), sales funnels, forms & microsites. Prepare to embed forms, videos, websites & links to your slides. A fast & engaging business proposal & presentation creation tool for “No Code” creators & busy professionals. Palo Alto, CA, USA. Decktopus Inc.",Active,https://www.decktopus.com,USA,"SaaS,no code",,https://twitter.com/decktopus,https://www.crunchbase.com/organization/decktopus,,,,1 April 2022
41,"""DEMAND SCIENCE, LLC""","Demand Science DemandScience demandscience.com @DemandScience (Buyer Intelligence Platform / B2B Sales Enablement & Market Intelligence Solutions). Topsfield, Massachusetts, USA. 19-Apr-2021, completed the acquisition of Leadiro leadiro.com @leadiro B2B sales enablement, sales intelligence & data enrichment platform with 60M+ verified records. Moreover, Demand Science achieved 50% CAGR since 2014, & is on track to exceed $100M in revenue in 2021. UK-based Leadiro experienced more than 100% year-over-year revenue and EBITDA growth in 2020. Q1 was a record revenue quarter with approximately 150% year-over-year revenue growth. Demand Science is a global buyer intelligence platform that accelerates demand generation for the world’s largest software, technology & B2B companies. It delivers data & prioritized buyer insights that align sales & marketing professionals with more qualified audiences through its PureB2B, Klarity, Internal Results, Leadiro, Tidings, & BIOMES brands. Interestingly on 3-Feb-2022 klarity.com started to redirect to leadiro.com. 20-Jul-2021: Airborne App Airborneapp airborneapp.io @Airborneapp_io sales engagement & enablement software platform (Toronto, ON, Canada) acquired by Demand Science. 8-Feb-2021, global buyer intelligence platform @DemandScience acquired Tidings @TidingsCo an on-demand automated newsletter creation SaaS platform, to expand its sales enablement (klarity.com which used to be prospectone.com) & intelligence solution suite.","Active,Rebranding",https://demandscience.com,USA,,,https://twitter.com/DemandScience,https://www.crunchbase.com/organization/demand-science,,B2B,,20 April 2023
30,"""Consensus Sales, Inc.""",DemoChimp see CONSENSUS,"Rebranding,Active",https://www.goconsensus.com,,,,,,,,,20 January 2023
,Demodesk GmbH,"Demodesk demodesk.com @demodesk customer meeting platform for sales & success teams / revenue teams. Provides real-time sales coaching, increase sales efficiency, & engage customers at scale. 100% online. Win more deals, faster: Intelligent customer meeting platform that helps you increase sales velocity & drive more revenue. Automates non-selling tasks & enables sellers in real-time. Drive revenue, cut down on ramp time, increase quota attainment, & boost sales productivity. Integrates with your CRM, calendar, & the rest of your sales stack to help you automate manual tasks & scale your process. Playbooks & Battlecards: Your real-time sales assistant. Automatically load the perfect playbook into every meeting: Slides, web apps, talk tracks & battle cards on the spot. Automatically load the perfect slides, websites & speaker notes into every customer meeting. Handle objections in real-time: Easily navigate sales objections & answer critical questions with battle cards. Instantly have all the content & guidance you need available during every customer call. Personalize pitches without the effort: Automatically customize every pitch with dynamic tokens – personalize content & recall the right data into all your meetings. Ensure that everyone can quickly access the most up-to-date sales content. Always know your team has a unified sales narrative with team playbooks. The right content at the right time: Manage & sync your sales collateral with the tools you use to automate meeting prep & to start every meeting with all the right content. Demodesk GmbH, Munich, Germany. Demodesk Inc, San Francisco, CA, USA. London, UK",Active,https://demodesk.com,"Germany,USA",SaaS,,https://twitter.com/demodesk,https://www.crunchbase.com/organization/demodesk,,B2B,,1 May 2023
,"""Naro Technologies, Inc.""","Demoflow demoflow.io @thedemoflow (“Complete demo enablement platform to streamline prep, presentation, follow-up, & documentation across the sales org.”) was acquired by Naro narohq.com in July 2023! Legal Name: Naro Technologies, Inc. Gondola gondola.ai (Legal Name: Swivel Demos Inc.) formerly known as Demoflow. Naro narohq.com accelerate revenue growth with AI-driven sales enablement. Offers content from a company, peers, & industry and Accelerates revenue growth with AI sales enablement. The right sales content, right when you want it! Naro brings together knowledge & content from your company, your peers, & your industry and makes it work in your workflow. Your always-on sales knowledge assistant: Naro sits in the background while you work & uses contextual clues to proactively find you what you need for every customer conversation. We unify all the content you care about – from snippets to slides. There’s no need to learn another UI since we work right in Gmail, LinkedIn, etc. We automatically create summaries & extract the most relevant information based on your conversation. Denver, Colorado, United States. Legal Name: Naro Technologies, Inc.","Rebranding,Acquired",https://www.narohq.com,USA,,,,,,B2B,,1 November 2023
